### ISSUE TITLE
Should MP via network work on OSX?

### ISSUE THREAD

**Issue by snrkl** [yquake2/yquake2#263]
Hi - I have been playing with this and have managed to get it all working single player..
(instructions were great - thanks for that!)

Quick question: Should multiplayer on OSX work? Client cannot see the server in the server browser.  (Tried with three macs  (2x Mavericks 10.11.6 and 1x Sierra 10.12.6). Doesn't work in any direction...

No firewalls in the way or networking problems.. machines are both on the same Layer2 subnet (same network LAN segment) and can ping each other just fine..

outright `connect <ip.add.re.ss>` just times out:

Client gives a "`NET_Socket: bind: Address already in use`" error,  then just says:
```
Connecting to <ip.add.re.ss>... 
Connecting to <ip.add.re.ss>... 
Connecting to <ip.add.re.ss>... 
```

A tcpdump on the server shows the client broadcasting trying to find the server.. If I use a 'connect' command, you can just see the client connecting and no response from the server:

```
23:21:21.124292 IP 10.10.10.100.64726 > 255.255.255.255.27910: UDP, length 11
23:21:26.113305 IP 10.10.10.100.64726 > 255.255.255.255.27910: UDP, length 11
23:21:45.672761 IP 10.10.10.100.60290 > 10.10.10.103.27910: UDP, length 17
23:21:48.677614 IP 10.10.10.100.60290 > 10.10.10.103.27910: UDP, length 17
23:21:51.686695 IP 10.10.10.100.60290 > 10.10.10.103.27910: UDP, length 17
23:21:54.695611 IP 10.10.10.100.60290 > 10.10.10.103.27910: UDP, length 17
```
etc...

I have tried this in both directions, and the same behaviour is seen either way (ie: Machine A server, Machine B client.. retest with Machine A client, Machine B server...)

**Comment by Yamagi** [comment]
It should, of course. But I don't thing that anyone tested it in the last years. And I don't have a Mac to do it... :/

**Comment by Yamagi** [comment]
Can anyone tell if this still is a problem with the current HEAD?

**Comment by snrkl** [comment]
Are there precompiled OSX binaries for the version you want me to test? A look at https://deponie.yamagi.org/quake2/osx/ shows me a 7.20 binary download, but not a 7.30 binary..

If you can let me know in a little more detail what you want me to test, I am happy to do it..

**Comment by Yamagi** [comment]
We've got finally a 7.30 binary: https://deponie.yamagi.org/quake2/osx/yquake2-7.30-OSX-10.7.5+.dmg

**Comment by snrkl** [comment]
Great. I’ll take a look when I get a free second.

**Comment by Yamagi** [comment]
No feedback for 3 month and no other complains. If this is still an issue feel free to open a new bug report.
